71,72,1,"IIASA IMPORTADORA INDUSTRIAL AGRÍCOLA (IASA-SERVICIO, MODERMAR, GOMILGROUP, IASA-TRANSPORTE, LUBRIVAL, LUBRIANSA)",SI,0,0,5,0,20,0,6,1,,,25,101,133,32,"3,236,956","190,619,140",1.70%,"4,610,361","246,653,423",1.87%,-22.72%,-29.79%,-0.17%,"8,086,570","1,608,935",0,0,"400,628,453","404,926,947","280,952,246","274,600,767","7,623,866","7,075,606"
72,68,-4,"EXPALSA (INTEDECAM, ECUACULTIVOS, PLUMONT, YEKATOP, CONSAVE, CIMINOCORP)",PARCIALMENTE,2,2,6,0,40,7,3,1,,,46,171,220,49,"2,940,183","350,932,421",0.84%,"5,030,608","494,820,985",1.02%,-29.08%,-41.55%,-0.18%,"695,841","64,253",0,0,"233,010,982","192,388,403","131,516,445","110,638,998","8,340,453","10,974,102"
73,54,-19,HALLIBURTON LATIN AMERICA (SERVICIOS PETROLEROS),NO,7,0,0,0,2,24,2,2,,,2,71,6,-65,"3,543,285","151,177,210",2.34%,"23,335,754","298,882,863",7.81%,-49.42%,-84.82%,-5.46%,"7,242,036","111,702",0,0,"522,205,926","672,884,814","146,100,465","151,347,073","33,114,025","26,342,764"
74,73,-1,"PLUSPETROL ECUADOR (AGIP GAS, ESAIN, TECNOESA)",PARCIALMENTE,0,0,0,1,5,3,3,2,,,6,59,15,-44,"5,015,449","188,564,792",2.66%,"17,189,592","254,167,022",6.76%,-25.81%,-70.82%,-4.10%,"944,349","54,635",0,0,"370,017,777","379,099,784","296,103,393","286,533,776","18,015,839","22,717,975"
75,81,6,"TECOPESCA (GRUPOVISION GVHOLDING, EMPACADORA BILBO, MANCORSACOM, CROPILETTO, TEVEMAS)",SI,0,0,5,0,44,0,5,1,,2,49,176,208,32,"1,563,190","194,327,874",0.80%,"2,160,800","195,797,499",1.10%,-0.75%,-27.66%,-0.30%,"596,559","61,301",0,0,"411,011,712","396,596,341","200,447,014","189,049,852","3,803,342","3,410,743"
76,75,-1,"HOTEL COLÓN (HOTEL HILTON COLON QUITO, MALAGAGROUP, HIDROSIGCHOS, DOSMILCORP, INTERFIBRA, HILTEXPOY, LANAFIT, ECUACOTTON, RIBEL)",SI,1,0,8,0,87,2,12,0,,,95,84,56,-28,"1,564,675","75,661,025",2.07%,"4,858,047","133,400,128",3.64%,-43.28%,-67.79%,-1.57%,"2,776,391","8,347",0,0,"520,224,447","515,212,226","314,440,430","294,875,831","4,398,662","8,588,882"
77,64,-13,"PLASTICAUCHO (E MAULME, PROAUTO, ECUATRAN, HIDROTAMBO, TEIMSA, VENUS,  DISTRISHOES, FAAUTO)",SI,0,0,15,2,35,2,9,4,1,,52,197,164,-33,"1,565,419","226,177,561",0.69%,"5,401,320","367,379,078",1.47%,-38.43%,-71.02%,-0.78%,"3,083,541","341,643",0,0,"341,024,099","363,984,532","175,210,567","184,232,649","10,359,165","14,539,928"
78,77,-1,"PICA PLÁSTICOS INDUSTRIALES (PYCCA, HOTEL ORO VERDE, INMOPICA - INMUEBLES PICA, UNICENTRO TURÍSTICO JABUCAM, GRUPO UNICENTRO UNIHOT, PRECONSA, ILPONTO)",SI,4,0,6,0,40,5,6,2,,,46,111,55,-56,"2,637,176","170,658,875",1.55%,"8,341,207","226,693,538",3.68%,-24.72%,-68.38%,-2.13%,"2,782,835","953,193","5,310","6,562","386,419,176","386,087,560","237,823,849","239,582,234","9,827,283","15,415,781"
79,78,-1,"NOVACERO (SWISSOTEL QUITO, AGRICOLAPUEMBO, INMOGRA, PRODAGUA)",SI,10,0,4,2,12,15,2,1,,,18,138,268,130,"2,691,186","221,997,828",1.21%,"1,453,023","276,462,895",0.53%,-19.70%,85.21%,0.69%,"9,090,336","607,201",0,0,"345,054,324","339,110,948","165,922,277","161,714,207","12,314,220","16,179,445"
80,71,-9,"CORPORACIÓN MARESA HOLDING (DISTRIVEHIC, ORGU COSTA, AVIS RENT A CAR, MARESACENTER, GLOBALMOTORS GLOBMOT SA, AUTOSDELSUR)",PARCIALMENTE,2,31,6,0,21,6,4,4,,,27,177,248,71,"1,626,180","202,397,340",0.80%,"2,284,437","319,971,055",0.71%,-36.75%,-28.81%,0.09%,"8,965,417","91,678",0,0,"346,985,917","377,136,252","158,614,088","150,963,925","7,804,353","10,874,844"
81,88,7,"MODERNA ALIMENTOS (MOLINOS CHAMPION MOCHASA, CONTISEA HOLDING, AGRÍCOLA SAN ANDRES DEL CHAUPI, NUTRADELI ECUADOR)",PARCIALMENTE,3,2,8,1,11,7,2,2,,,20,82,155,73,"5,393,387","258,794,320",2.08%,"4,182,054","250,766,849",1.67%,3.20%,28.97%,0.42%,"8,560,358","13,041",0,0,"255,862,887","242,345,466","180,874,275","194,652,149","7,816,945","4,001,680"
82,79,-3,"MAVESA (MOTOREC, RENPACIFSA, QUALITYSEG)",SI,0,0,1,0,11,0,2,1,1,,12,253,246,-7,"573,959","167,199,660",0.34%,"1,643,578","227,270,598",0.72%,-26.43%,-65.08%,-0.38%,"11,900,746","1,221,931",0,0,"360,675,050","379,157,972","199,654,579","193,224,592","3,695,487","6,952,718"
83,84,1,"HOLDINGDINE CORPORACIÓN INDUSTRIAL Y COMERCIAL (ANDEC, HOTEL MARRIOTT, EMSAAIRPORT SERVICES CEM, INMOSOLUCIÓN, EXPLOCEN, INAMAZONAS INMOBILIARIA)",NO,0,0,0,0,20,0,8,1,1,,20,174,128,-46,"1,091,862","133,543,996",0.82%,"2,820,290","148,742,494",1.90%,-10.22%,-61.29%,-1.08%,"1,537,423","82,986",0,0,"375,282,099","401,619,802","254,803,907","260,167,169","10,238,798","12,817,068"
84,93,9,"CORPORACIÓN SUPERIOR (GRUPO SUPERIOR, ALSUPERIOR, INSELESA, SERVINDINSA, ENSUPERIOR, SUPERLIQUORS)",SI,0,0,8,1,32,0,3,1,,,41,47,73,26,"6,490,222","217,275,688",2.99%,"6,474,015","210,262,001",3.08%,3.34%,0.25%,-0.09%,"6,254,855",243,0,0,"315,361,721","290,189,418","164,385,182","162,863,947","9,008,281","10,584,080"
85,87,2,CITIBANK N. A. SUCURSAL ECUADOR (CORPIFEXSA),NO,0,0,0,0,4,5,1,1,1,,4,2,5,3,"5,311,637","51,830,290",10.25%,"5,468,394","59,340,052",9.22%,-12.66%,-2.87%,1.03%,"556,713",0,"290,070","264,088","621,867,320","641,532,681","83,164,141","90,767,535","140,276,978","166,635,702"
86,85,-1,"CENTROS COMERCIALES DEL ECUADOR (IMPRENTA MARISCAL, CONDADO SHOPPING, INMODIAMANTE, IVAN BOHMAN C.A., CENTRO COMERCIAL IÑAQUITO, HOTEL DANN CARLTON, MUNDO FERRETERO)",PARCIALMENTE,0,11,3,13,54,34,9,2,,,70,73,96,23,"3,873,165","170,440,962",2.27%,"5,043,842","210,974,238",2.39%,-19.21%,-23.21%,-0.12%,"4,137,003","330,184",0,0,"374,809,475","372,724,770","158,033,988","157,062,947","10,197,009","10,295,230"
87,83,-4,"OCEANBAT (VEPAMIL, OCEANBAT, HISPANA DE SEGUROS, EXPODELTA, BIOFACTOR, HISPANOGROUP, ABATANGELO)",PARCIALMENTE,0,0,4,0,30,2,7,2,1,,34,239,230,-9,"1,110,545","256,738,977",0.43%,"2,917,447","317,111,497",0.92%,-19.04%,-61.93%,-0.49%,"2,513,321","55,609",14,57,"252,727,028","240,022,754","90,220,819","93,841,933","8,130,716","11,084,662"
88,90,2,"SALICA (GUAYATUNA, ZONA FRANCA DE POSORJA ZOFRAPORT, EMPACADORA DE TUNIDOS TUNAPAC, ECUANAÚTICA)",SI,0,0,0,14,10,9,2,2,,,24,288,299,11,0,"224,537,870",0.00%,"2,386","238,253,510",0.00%,-5.76%,-100.00%,0.00%,755,36,0,0,"248,603,016","252,223,658","146,434,994","147,042,282","6,209,289","12,164,676"
89,105,16,"ENAP SIPETROL (EOP OPERACIONES PETROLERAS, CONSORCIO BLOQUE 28)",NO,0,0,0,0,3,3,1,1,,,3,1,2,1,"22,856,067","190,258,139",12.01%,"26,384,610","192,461,604",13.71%,-1.14%,-13.37%,-1.70%,"36,051",0,0,0,"354,815,257","320,156,997","166,604,985","89,734,308","24,760,262","19,034,658"
90,94,4,"MEGA SANTAMARÍA (INMOBILIARIA INMOELMANA, FIDEICOMISO MERCANTIL VICENTINA)",SI,0,0,0,1,4,2,2,1,,,5,162,223,61,"3,045,086","312,040,210",0.98%,"3,019,644","317,515,632",0.95%,-1.72%,0.84%,0.02%,"193,441",0,0,0,"143,850,000","152,058,905","48,878,186","41,327,553","11,681,042","9,771,816"
91,102,11,"INDUSTRIA LOJANA DE ESPECERIAS ILE (COOPMEGO, GODOY RUIZ, S.I.M.E.G.O)",SI,0,0,7,0,14,0,4,0,,,21,124,110,-14,"1,753,727","125,454,029",1.40%,"2,490,487","114,656,365",2.17%,9.42%,-29.58%,-0.77%,"218,933","64,230",0,0,"425,656,133","394,118,084","81,746,983","76,504,650","6,620,053","5,237,512"
92,97,5,"CONSERVAS ISABEL (SEAFMAN, TADEL, INVER AUREA, IROTOP, SERVUS SHIPPING)",SI,1,2,1,6,8,13,3,2,,,15,132,173,41,"3,773,051","288,689,582",1.31%,"3,928,648","282,694,383",1.39%,2.12%,-3.96%,-0.08%,"1,354,208","86,738",0,0,"159,637,579","157,541,805","74,287,276","67,711,518","10,151,404","10,048,157"
93,89,-4,"CONTINENTAL TIRE ANDINA (TEDASA, NATIONALTIRE EXPERTS, SEGURILLANTA, ANDUJAR, TECNIGUAY, RENOVALLANTA, TECNILLANTA)",NO,0,0,0,0,13,9,9,1,,,13,183,189,6,"1,462,034","184,920,907",0.79%,"3,052,714","240,893,170",1.27%,-23.24%,-52.11%,-0.48%,"4,082,936","61,844",0,0,"251,273,724","264,767,321","151,802,674","155,074,508","9,935,102","10,896,544"
94,80,-14,"LATAM (LAN CARGO, LAN AIRLINES, AEROLINHAS BRASILEIRAS, LATAM AIRLINES PERU, LINEA AEREA CARGUERA DE COLOMBIA)",PARCIALMENTE,0,0,0,3,8,15,3,2,,,11,287,274,-13,0,"160,416,217",0.00%,"1,686,074","346,463,745",0.49%,-53.70%,-100.00%,-0.49%,"10,456,608","19,386",0,0,"324,700,330","284,883,292","76,055,718","44,890,580","11,840,911","20,410,090"
95,91,-4,"UNILEVER ANDINA ECUADOR (VISANUASA, DOMA, MARGA)",NO,0,0,0,0,2,4,1,1,,,2,25,47,22,"10,345,009","267,427,159",3.87%,"13,967,740","330,623,642",4.22%,-19.11%,-25.94%,-0.36%,"9,439,339","342,659",0,0,"164,144,034","182,897,811","62,175,819","55,257,555","37,836,248","51,139,979"
96,86,-10,"AMBACAR (CIAUTO, AUTOMEKANO, ARBORIENTE, MADEARQ)",SI,0,0,10,0,10,0,7,2,,,20,100,50,-50,"4,240,122","246,620,943",1.72%,"14,115,898","345,395,812",4.09%,-28.60%,-69.96%,-2.37%,"8,414,454","81,708",0,0,"173,110,688","182,802,627","90,279,924","82,525,456","17,224,490","22,601,933"
97,103,6,"ELECTROCABLES (TUBOS PACÍFICO, BOYACA, MINUTOCORP, PHARMACAPS, DOLTREX, CORPORACIÓN SICORPMATTRESS)",SI,0,0,22,0,77,0,5,2,,,99,248,244,-4,"520,712","139,870,967",0.37%,"1,008,307","138,477,608",0.73%,1.01%,-48.36%,-0.36%,"2,385,887","208,775","8,710","1,853","327,555,896","328,941,174","110,733,028","106,769,216","3,357,007","5,442,486"
98,95,-3,"GRAIMAN (TUBERÍA GALVANIZADA ECUATORIANA, INDUATENAS, INDUBUSINESS, HOLDING HOLDPRO, INDUGOLFO,  JUMILLA, PECALPA, VANDERBILT)",SI,1,20,8,0,27,18,5,1,1,,35,147,166,19,"1,553,061","137,846,140",1.13%,"2,359,858","161,879,692",1.46%,-14.85%,-34.19%,-0.33%,"2,798,640","716,814",0,0,"290,483,918","302,941,323","156,716,579","174,166,796","8,579,792","8,069,754"
99,100,1,"PROMARISCO (MEGASHAK, SOMBRACORP)",NO,0,0,0,0,4,6,2,1,,,4,160,222,62,"2,427,303","247,127,625",0.98%,"2,643,477","277,489,334",0.95%,-10.94%,-8.18%,0.03%,"1,577,504","27,304",0,0,"160,541,154","154,007,276","50,916,522","50,199,805","6,498,801","8,242,542"
100,82,-18,"IMBAUTO (VALLEJO ARAUJO, INMOBILIARIA CONSTRUHORIZON ECUADOR, OIL GROUP, CORPORACIÓN-WAY, LA PLAZASHOPP)",SI,0,0,6,0,34,2,5,2,,,40,250,266,16,"581,393","158,360,913",0.37%,"1,586,315","285,290,359",0.56%,-44.49%,-63.35%,-0.19%,"431,627","94,565",0,0,"264,895,212","297,628,511","85,912,280","95,898,843","8,976,257","8,620,689"
101,115,14,"UNIVERSIDAD DE LAS AMÉRICAS (SERVICIOS PROFESIONALES AD PORTAS, CORPORACIÓN CIENTÍFICO HUMANISTA UDLA)",PARCIALMENTE,1,0,0,1,4,21,2,0,,,5,244,281,37,"423,495","104,687,732",0.40%,"460,353","117,740,920",0.39%,-11.09%,-8.01%,0.01%,"900,875",790,0,0,"281,905,290","239,126,311","236,694,068","203,518,784","5,245,401","7,413,320"
102,123,21,BANCO PROCREDIT (FIDEICOMISO MERCANTIL DE GARANTÍA DEL FONDO DE LIQUIDEZ DEL SISTEMA FINANCIERO PRIVADO BANCO PROCREDIT),NO,0,0,0,0,2,1,1,1,1,,2,85,81,-4,"846,736","41,041,993",2.06%,"1,038,852","37,511,929",2.77%,9.41%,-18.49%,-0.71%,"101,872",0,"162,834","111,446","489,235,017","396,274,820","57,687,708","57,547,151","14,597,457","10,814,545"
103,109,6,"QUIFATEX (QSI, SAFIMO, VANTTIVE HEALTH SOLUTIONS)",PARCIALMENTE,1,0,1,2,5,10,3,1,,,8,166,199,33,"2,182,763","240,756,212",0.91%,"2,937,166","248,214,005",1.18%,-3.00%,-25.68%,-0.28%,"4,501,446","725,450",0,0,"154,257,652","146,028,126","57,146,481","53,983,636","5,061,131","6,550,587"
104,117,13,"ENVASES DEL LITORAL (PLASTICOS DEL LITORAL PLASTLIT, INVERSIONES GERMANIA, SIMOSA, IMPREDI, LITOMOVIL)",SI,8,0,3,2,22,10,2,2,,,27,114,148,34,"1,648,339","107,929,824",1.53%,"1,713,025","101,085,004",1.69%,6.77%,-3.78%,-0.17%,"2,353,017","243,985",0,0,"300,179,861","290,711,616","112,424,024","109,499,236","3,443,728","3,520,655"
105,107,2,"GRUPO PAPELERO GRUPASA (PAPELESA, AGPSA ALMACENES GENERALES DE PAPELES, PRAMERCI, IMPOFORM)",SI,0,2,3,0,10,0,4,2,,,13,86,99,13,"3,904,311","191,625,112",2.04%,"5,351,313","228,693,160",2.34%,-16.21%,-27.04%,-0.30%,"2,622,568","279,649",0,0,"173,265,027","174,206,548","113,318,089","96,080,299","4,434,857","7,501,071"
106,92,-14,"ITABSA INDUSTRIAS DEL TABACO ALIMENTOS Y BEBIDAS (PROESA, TANASA)",NO,0,0,0,0,3,6,3,3,,,3,142,183,41,"3,283,523","275,634,902",1.19%,"5,091,511","378,547,686",1.35%,-27.19%,-35.51%,-0.15%,"1,788,128","13,773",0,0,"81,494,796","97,942,042","21,711,890","18,401,374","91,657,294","134,128,206"
107,96,-11,"AYASA (FOTON DEL ECUADOR, AUTO INNOVACIÓN, TELEQUINOX)",SI,0,2,7,0,9,2,2,1,,4,16,267,232,-35,"259,621","175,274,808",0.15%,"2,311,220","256,172,048",0.90%,-31.58%,-88.77%,-0.75%,"9,934,549","95,097",0,0,"206,133,587","208,036,995","68,400,758","71,053,221","6,711,964","7,378,763"
108,118,10,"CONTECON GUAYAQUIL (LOGIPUERTO, LEKANSTAR)",SI,0,0,0,1,3,8,1,1,,,4,6,43,37,"8,601,540","114,222,023",7.53%,"4,910,575","112,362,309",4.37%,1.66%,75.16%,3.16%,"374,833","8,672",0,0,"274,568,993","265,654,360","146,561,773","124,998,326","10,010,166","7,262,274"
109,114,5,"GRUPO TVCABLE (SETEL, SATELCOM, SURATEL, GRUPO EMPRESARIAL STCT)",NO,0,0,0,0,8,2,4,1,,5,8,29,74,45,"4,187,793","124,194,773",3.37%,"4,610,230","150,460,052",3.06%,-17.46%,-9.16%,0.31%,"3,082,689","311,561",0,0,"249,676,165","253,018,281","129,735,508","119,204,980","29,222,333","31,259,177"
110,113,3,IPAC (DUFERCO PARTICIPATIONS HOLDING),PARCIALMENTE,2,0,0,2,1,5,1,1,,,3,87,158,71,"3,145,078","159,528,826",1.97%,"3,036,940","191,759,371",1.58%,-16.81%,3.56%,0.39%,"12,886,796","189,832",641,765,"198,959,836","197,111,602","111,165,748","102,614,977","1,276,955","991,250"
111,108,-3,"UNACEM ECUADOR (UNICON,CANTYVOL )",NO,0,0,0,0,6,4,3,1,,,6,10,20,10,"8,678,778","138,082,216",6.29%,"9,926,938","163,105,797",6.09%,-15.34%,-12.57%,0.20%,"1,586,251","3,911",0,0,"237,373,328","263,680,891","124,185,254","137,999,823","25,552,099","25,545,597"
112,122,10,"CONSORCIO CGGC FOPECA (CHINA GEZHOUBA GROUP, FOPECA, CONSUR R7H, GARDAEXPORT)",PARCIALMENTE,0,0,2,0,6,1,5,2,,,8,139,213,74,"1,091,063","90,133,841",1.21%,"1,016,509","93,995,236",1.08%,-4.11%,7.33%,0.13%,"168,711","3,322",0,0,"322,795,877","285,102,049","68,001,767","83,031,989","7,947,802","6,157,067"
113,124,11,CHUBB SEGUROS ECUADOR (CONSORCIO ACE-QBE),NO,0,0,0,0,2,6,1,1,,,2,21,48,27,"6,964,327","163,709,813",4.25%,"7,162,451","170,389,141",4.20%,-3.92%,-2.77%,0.05%,"2,393,434","2,985","1,867","1,804","204,080,459","180,565,590","76,791,836","54,081,617","23,127,904","18,730,213"
114,116,2,"INPROEL (INESA, SISELEC, ECUACABLE, DERMIGON DERIVADOS DE HORMIGON, EMECORP, PANELEC)",PARCIALMENTE,0,0,5,0,49,3,8,1,,,54,144,169,25,"1,453,814","127,162,720",1.14%,"2,284,936","158,314,291",1.44%,-19.68%,-36.37%,-0.30%,"2,603,141","174,177",0,0,"238,867,703","225,360,299","78,503,648","75,854,083","4,637,950","5,328,599"
115,98,-17,"CRECOSCORP (CRECOSA, MOTOSA, CSGCORP, PROTOS, COSTUREX, CONDICICOM , PUNTA CABUYA, VERANDA, CONELFURO)",PARCIALMENTE,1,0,3,0,16,2,2,1,,,19,256,90,-166,"322,218","111,569,313",0.29%,"5,090,392","201,371,429",2.53%,-44.60%,-93.67%,-2.24%,"2,198,401",203,0,0,"229,417,836","259,974,223","105,197,377","111,082,560","8,008,716","13,848,756"
116,119,3,"COPACIGULF (CABAQUI, INTEDECAM, EMCAMEX, GAMBIRASI, CAMARONERA CAMANMOR)",SI,0,0,3,0,23,0,4,0,,,26,143,115,-28,"2,134,803","182,876,766",1.17%,"4,472,818","213,814,446",2.09%,-14.47%,-52.27%,-0.92%,"40,166",0,0,0,"147,165,786","144,011,408","59,381,503","52,367,357","4,613,803","5,721,512"
117,112,-5,"TEOJAMA COMERCIAL (EL SALTO AGRICOLA E INDUSTRIAL, INMOBILIARIA TARQUI, SATRACK, LA MANSIÓN)",SI,0,3,2,0,8,0,1,1,,,10,105,136,31,"1,291,312","78,030,891",1.65%,"2,219,759","121,146,186",1.83%,-35.59%,-41.83%,-0.18%,"4,144,737","315,472",0,0,"255,049,055","277,307,382","134,787,336","149,028,740","3,943,590","4,617,699"
118,125,7,"CONCLINICA (HUMANA, FUNDACION METROFRATERNIDAD, METRORED)",SI,0,0,3,0,6,0,3,1,,,9,103,182,79,"2,581,097","153,954,964",1.68%,"2,178,132","161,672,150",1.35%,-4.77%,18.50%,0.33%,"74,411",341,0,0,"165,151,650","148,864,842","100,899,836","93,218,899","5,500,563","6,528,295"
119,104,-15,"ETAFASHION (TIENDEC, ETALI)",PARCIALMENTE,0,0,4,0,13,4,2,2,,,17,276,141,-135,"121,518","132,347,742",0.09%,"3,922,603","221,607,612",1.77%,-40.28%,-96.90%,-1.68%,"978,560","245,207",0,0,"228,837,478","239,749,042","35,552,373","37,774,038","9,880,526","14,776,963"
120,106,-14,"CORPETROLSA (EXPORSWEET, LUDERSON, DLEN, SERVAMAIN, GESURYMACA)",SI,0,0,2,1,17,0,4,1,,,20,249,197,-52,"672,295","182,584,577",0.37%,"3,277,293","274,739,422",1.19%,-33.54%,-79.49%,-0.82%,"615,116","21,932",0,0,"141,853,458","137,376,879","42,222,960","42,998,978","3,408,203","4,620,625"
121,129,8,"BANCO AMAZONAS (LIFPRODEC, ZEUDI ENTERPRISES)",SI,7,0,4,0,67,9,2,1,1,1,71,261,237,-24,"88,067","39,046,541",0.23%,"345,965","43,248,759",0.80%,-9.72%,-74.54%,-0.57%,"49,028",903,"31,119","20,363","339,631,936","316,390,901","95,945,105","96,350,427","2,415,808","3,179,172"
122,110,-12,ARTEFACTOS ECUATORIANOS PARA EL HOGAR ARTEFACTA (CORPORACION GROMERON),PARCIALMENTE,4,0,0,5,1,7,1,1,,,6,273,258,-15,"128,941","129,865,640",0.10%,"1,208,846","190,198,325",0.64%,-31.72%,-89.33%,-0.54%,"1,650,180","110,965",0,0,"182,480,888","215,561,944","89,630,942","88,494,050","6,139,487","14,052,486"
123,138,15,"SIGMAPLAST (TINFLEX, NOVOVASOS, HEYAKA CONSTRUCTORES, ENGOMA ADHESIVOS, FIBRABUILDERS)",SI,0,0,8,0,16,0,3,1,,,24,129,153,24,"1,598,574","118,151,745",1.35%,"1,874,749","111,876,497",1.68%,5.61%,-14.73%,-0.32%,"3,402,669","78,606",0,0,"181,735,598","176,363,333","65,051,092","63,842,795","2,587,785","3,019,504"
124,143,19,"PROVEFRUT (NINTANGA, PROCONGELADOS, PROQUINOA, FLORES PASTAVI)",SI,0,0,3,0,14,6,3,1,,,17,63,100,37,"3,733,572","143,940,766",2.59%,"3,180,235","136,121,230",2.34%,5.74%,17.40%,0.26%,"565,254",0,0,0,"134,240,949","120,621,035","79,772,842","69,151,379","3,682,472","3,571,863"
125,136,11,"UNIVERSIDAD SAN FRANCISCO DE QUITO USFQ (FIDEICOMISO CAMPUS, SAN FRANCISCO FOODSERVICE USFQGROUP)",SI,0,0,0,0,7,0,1,0,,,7,283,298,,"4,843","83,712,286",0.01%,"35,932","93,951,573",0.04%,-10.90%,-86.52%,-0.03%,"236,331","3,115",0,0,"198,327,911","194,712,739","121,215,000","109,482,484","3,162,383","4,053,048"
126,126,0,"MULTICINES (AUTO DELTA, NOVAECUADOR, TE UNO, CONSTRUECUADOR)",SI,0,0,0,1,22,4,5,0,,,23,53,72,19,"2,392,767","85,971,124",2.78%,"4,001,864","129,769,440",3.08%,-33.75%,-40.21%,-0.30%,"435,341","4,443",0,0,"202,482,819","198,428,406","87,038,475","93,893,876","8,631,297","9,570,820"
127,127,0,"CONSORCIO PETROSUD PETRORIVA (PETROLEOS SUD AMERICANOS DEL ECUADOR PETROLAMEREC , PETRORIVA, CONSORCIO PETROLERO PALANDA -YUCA SUR, COMPAÑÍA SUDAMERICANA DE FÓSFOROS DEL ECUADOR FOSFOROCOMP)",SI,0,0,0,11,6,3,4,1,,,17,24,29,5,"4,298,367","106,573,342",4.03%,"9,405,721","168,465,316",5.58%,-36.74%,-54.30%,-1.55%,"24,313",0,0,0,"172,254,320","162,847,448","106,577,428","93,832,243","2,691,740","6,408,058"
128,128,0,"OBSA ORO BANANA (AUSURSA, JASAFRUT, LA MARAVILLA, CABANA, PICKUEL, SEDUC, FITECUA, INGAORO, APACSA)",SI,0,0,5,2,29,1,8,1,,,36,243,174,-69,"457,655","110,290,352",0.41%,"1,808,058","131,070,597",1.38%,-15.85%,-74.69%,-0.96%,"40,998","4,503",0,0,"163,512,751","177,199,047","81,079,267","87,851,203","2,021,473","2,190,958"
129,131,2,"CARTIMEX (FUROIANI OBRAS Y PROYECTOS, COMPUTRONS, XTRATECHCOMPUTER, ROYALBAY)",SI,2,0,7,2,52,6,2,1,,,61,192,259,67,"915,870","128,385,083",0.71%,"876,969","140,988,774",0.62%,-8.94%,4.44%,0.09%,"4,174,004","853,477",0,0,"159,295,490","171,793,584","41,117,603","45,310,328","3,455,615","3,638,859"
130,111,-19,"AUTOMOTORES CONTINENTAL (AUTOMOTORES CONTINENTAL, ECUA-AUTO, ECUA ¿ WAGEN, GERMANMOTORS, BUDGET, RENT A CAR, PROVEEDORA AUTOMOTRIZ, FLOWERFEST)",SI,0,2,2,1,17,7,5,1,,,20,262,276,14,"269,968","130,632,786",0.21%,"1,100,890","231,023,820",0.48%,-43.45%,-75.48%,-0.27%,"674,225",113,0,0,"131,910,637","160,058,718","55,676,262","65,265,769","6,332,637","8,129,139"
131,120,-11,"AUTOMOTORES DE LA SIERRA (IMPORTACIONES VENTURA IMPOVENTURA, CENTRALCAR, AUTOSIERRA, REENCAUCHADORA DE LA SIERRA, CAUCHOSIERRA, PUNTOSIERRA)",SI,0,0,9,0,20,0,5,1,,,29,275,255,-20,"113,635","121,303,197",0.09%,"1,209,702","178,584,407",0.68%,-32.08%,-90.61%,-0.58%,"2,249,007","94,783",0,0,"126,694,066","158,271,161","85,554,662","96,002,990","3,877,409","5,870,637"
132,133,1,"DURAGAS (FIBRO ACERO, CHI-VIT ECUADOR, SAKUNAO, BEST TRADING ASESORES)",PARCIALMENTE,0,0,7,0,18,2,3,2,,1,25,128,140,12,"2,211,924","162,384,568",1.36%,"3,076,694","169,952,338",1.81%,-4.45%,-28.11%,-0.45%,"1,756,160","16,191",0,0,"99,194,550","116,531,300","37,466,558","51,670,385","7,292,499","4,927,168"
133,139,6,"PROMESA PRODUCTOS METALÚRGICOS (KERISAM, BEROSEL, BIFIANCO, LIESCO)",SI,0,0,4,0,27,0,1,1,,,31,280,286,6,"34,628","74,768,198",0.05%,"249,107","84,528,045",0.29%,-11.55%,-86.10%,-0.25%,"3,284,478","321,665",0,0,"175,038,710","170,889,742","111,965,233","121,143,379","3,501,199","2,914,151"
134,142,8,"PYDACO (DISOR, FAVALLE, COMERCIALIZADORA P Y M, PESNUSAN )",SI,0,0,10,0,18,0,5,1,,,28,116,102,-14,"2,616,588","173,281,073",1.51%,"4,244,439","184,738,201",2.30%,-6.20%,-38.35%,-0.79%,"1,929,793",0,0,0,"67,267,971","64,087,846","36,549,799","31,532,547","7,870,573","5,789,920"
135,137,2,"DIRECTV ECUADOR (DTH ECUADOR, AT&T GLOBAL NETWORK SERVICES)",NO,0,0,0,0,3,10,2,1,,1,3,104,120,16,"2,877,369","173,390,253",1.66%,"3,787,772","187,251,040",2.02%,-7.40%,-24.04%,-0.36%,"6,051,757",320,0,0,"72,041,875","93,406,981","33,365,233","37,443,768","59,493,395","62,651,527"
136,150,14,"URIBE Y SCHWARZKOPF (FIDEICOMISO AQUA, FIDEICOMISO INMOBILIARIO YOO QUITO, FIDEICOMISO SHYRIS 18, FIDEICOMISO EPIQ, MIRACIELO, ARVALJO)",PARCIALMENTE,1,0,3,3,47,2,3,0,,,53,20,88,68,"997,843","22,436,168",4.45%,"1,425,938","55,973,038",2.55%,-59.92%,-30.02%,1.90%,"355,374",18,0,0,"313,587,914","247,771,141","19,695,389","21,992,137","3,504,683","4,754,628"
137,147,10,"MARBELIZE (PESDEL, FINCANONNOS, INCILIZY)",SI,0,0,6,0,14,0,2,1,,,20,231,215,-16,"586,540","115,709,553",0.51%,"1,220,094","114,121,302",1.07%,1.39%,-51.93%,-0.56%,"192,635","9,866",0,0,"147,140,893","148,655,107","38,387,176","42,920,374","1,658,907","1,622,571"
138,152,14,"UNIVERSIDAD PARTICULAR DE ESPECIALIDADES ESPÍRITU SANTO (CARACIOLO, ECOMUNDO CENTRO DE ESTUDIOS Y DISEÑO, COLEGIO DELFOS, CAJUDIORT)",PARCIALMENTE,0,2,1,0,23,0,2,0,,,24,182,217,35,"450,133","56,797,679",0.79%,"634,666","60,275,950",1.05%,-5.77%,-29.08%,-0.26%,"199,336",623,0,0,"179,946,682","173,077,661","150,966,092","145,085,705","3,012,361","4,292,617"
139,101,-38,"CONSORCIO LINEA 1 METRO DE QUITO ACCIONA ( CONSORCIO AB ESMERALDAS, ACCIONA AGUA, CONSORCIO AB LOJA)",PARCIALMENTE,0,0,0,2,16,14,3,1,,,18,118,21,-97,"1,644,372","111,237,460",1.48%,"15,948,465","262,424,073",6.08%,-57.61%,-89.69%,-4.60%,"1,077,308",0,0,0,"155,517,485","193,218,678","44,986,446","69,233,132","10,639,316","24,923,759"
140,158,18,"SERTECPET (BULLSUPPLY, PROBUSINESS)",SI,0,0,4,0,8,1,1,1,,,12,68,61,-7,"1,818,090","73,941,676",2.46%,"3,425,715","97,037,834",3.53%,-23.80%,-46.93%,-1.07%,"878,040","9,359",0,0,"168,644,289","132,287,977","121,225,204","86,355,908","5,611,785","11,309,265"
141,146,5,"ZAIMELLA DEL ECUADOR (MORCONELLO, GOCARMEL)",SI,0,0,1,0,3,0,1,1,,,4,28,58,30,"3,670,531","101,799,751",3.61%,"4,328,370","120,012,504",3.61%,-15.18%,-15.20%,0.00%,"5,111,673","343,146",0,0,"135,184,244","125,158,276","103,204,152","90,895,153","5,854,840","5,942,021"
142,159,17,"COMPAÑÍA VERDU (CARILLI, CONSORCIO ENLACE SETECIENTOS OCHENTA, CONSORCIO VIAL MANABI, CORREDOR VIAL DE LA COSTA CVIALCO, CARGA, VEHICULOS Y TRANSPORTE, C.V. TRANSPORTE)",SI,0,0,4,0,24,0,2,1,,,28,140,129,-11,"505,996","41,924,026",1.21%,"821,957","43,512,913",1.89%,-3.65%,-38.44%,-0.68%,"222,821","32,946",0,0,"210,157,749","181,939,264","122,418,095","114,195,976","1,045,603","3,579,801"
143,149,6,"SOCIEDAD MINERA LIGA DE ORO (GRANCOL, PESQUERA MARYCIELO, BURSA, INDMARZUL, ESTDICONST, SOCIEDAD MINERA NUEVA ROJAS SOMINUR)",SI,0,0,11,0,22,0,7,0,,1,33,22,64,42,"4,132,354","97,950,466",4.22%,"3,518,501","105,005,126",3.35%,-6.72%,17.45%,0.87%,"104,260","7,009",0,0,"166,940,893","158,124,549","52,217,780","48,379,243","6,364,075","6,216,073"
144,170,26,"PLANTACIONES DE BALSA PLANTABAL S.A. (COLUMBIA-FOREST PRODUCTS, PGS ECUADOR)",NO,0,0,0,0,3,6,2,1,,,3,95,218,123,"1,868,135","104,522,513",1.79%,"786,577","76,650,932",1.03%,36.36%,137.50%,0.76%,"333,880","2,638",0,0,"125,329,869","118,372,535","81,954,183","79,265,914","10,042,250","7,226,478"
145,151,6,"SANCHEZ AROSEMENA - SANCHEZ GUZMAN Y COMPAÑIA (FARIBALLCORP, INVERSIONES OMANI, ANGLO ECUATORIANA DE GUAYAQUIL, FUNDACION SANCHEZ AGUILAR, SANGUZHOLDING)",SI,0,0,4,0,18,0,1,0,,1,22,161,152,-9,"111,781","11,423,478",0.98%,"322,876","19,242,780",1.68%,-40.63%,-65.38%,-0.70%,"590,648","12,351",0,0,"257,223,572","258,954,612","106,893,032","108,418,634","722,665","861,049"
146,166,20,"ALVAREZ LARREA EQUIPOS MEDICOS ALEM (COMERCIAL INDUSTRIAL ECUATORIANA, MGLANDS, RACALEC, VOLKETSWILL)",SI,0,0,1,0,10,0,1,1,,,11,3,97,94,"6,013,444","72,933,846",8.25%,"1,411,880","59,645,998",2.37%,22.28%,325.92%,5.88%,"1,111,220","41,927",0,0,"165,517,459","166,892,750","98,043,133","82,144,412","2,832,763","2,922,850"
147,144,-3,"ANDINAMOTORS (MUNDOFACTOR, AUTOLINE, CHINAMOTORS, ALAMEDA HOTEL MERCURE, MEGAVEHICULOS,  PALMELINA, FORTALTRIUN, FERRIBAN, HOTEL EMBASSY)",SI,0,0,9,2,65,4,5,0,,,76,137,101,-36,"485,151","39,641,868",1.22%,"1,523,019","66,090,031",2.30%,-40.02%,-68.15%,-1.08%,"529,132","4,545",0,0,"212,868,527","203,078,138","87,579,206","89,656,060","1,773,534","3,587,060"
148,121,-27,"TAGSA (ECOGAL, QUITOTELCENTER, TERMICARGA)",SI,12,0,0,1,9,28,3,1,,,10,205,82,-123,"429,086","64,868,718",0.66%,"3,831,250","138,954,161",2.76%,-53.32%,-88.80%,-2.10%,"347,041","1,553",0,0,"186,914,120","238,213,113","61,759,781","76,392,045","5,129,088","7,492,892"
149,160,11,"COMERCIAL CARLOS ROLDAN ( IMPORTADORA ROLORTIZ, ECUABEIBEN, AUSTROPARTS, AUTOMOTORES TRINITY)",SI,0,0,1,0,14,0,3,1,,,15,37,76,39,"3,239,939","104,530,927",3.10%,"3,153,055","109,277,969",2.89%,-4.34%,2.76%,0.21%,"4,753,965","2,423",0,0,"132,100,440","120,163,506","61,253,746","51,850,280","6,241,949","5,101,429"
150,155,5,"INTEGRACIÓN AVÍCOLA ORO (FIDEICOMISO MARIA ISABEL, ELGAVILAN, ECUACHOCOLATES)",SI,0,0,4,0,7,0,1,1,,,11,117,127,10,"1,364,338","91,144,906",1.50%,"2,114,743","109,997,630",1.92%,-17.14%,-35.48%,-0.43%,"1,026,815",0,0,0,"134,157,326","126,122,747","79,452,221","75,742,361","2,538,147","2,336,121"
